<?xml version="1.0" encoding="UTF-8"?>
<top-level xmlns:xsi="http://www.w3.org/2001/XMLSchema-instance"
  xsi:schemaLocation="http://csrc.nist.gov/ns/metaschema/testing/fields/with/flags schema.xsd"
  xmlns="http://csrc.nist.gov/ns/metaschema/testing/fields/with/flags" id="test">
  <complex-field1 id="complex-field1">test-string</complex-field1>
  <complex-field2 id="complex-field2-1">test-string2</complex-field2>
  <complex-fields3>
    <complex-field3 id2="complex-field3-1">test-string3</complex-field3>
    <complex-field3 id2="complex-field3-2">test-string4</complex-field3>
  </complex-fields3>
  <complex-field4 id2="complex-field4-1">test-string5</complex-field4>
  <complex-field4 id2="complex-field4-2">test-string6</complex-field4>
</top-level>
